Reading OpenROAD database at '/home/ngoduc/test_adder16/runs/RUN_2025-11-28_20-54-11/38-openroad-globalrouting/adder16.odb'…
Reading library file at '/home/ngoduc/.ciel/ciel/sky130/versions/0fe599b2afb6708d281543108caf8310912f54af/sky130A/libs.ref/sky130_fd_sc_hd/lib/sky130_fd_sc_hd__tt_025C_1v80.lib'…
Reading design constraints file at '/nix/store/j0zxygszwgin6pwkx80mnja2sn8pcc6d-python3-3.11.9-env/lib/python3.11/site-packages/librelane/scripts/base.sdc'…
[INFO] Using clock clk…
[INFO] Setting output delay to: 0.96
[INFO] Setting input delay to: 0.96
[INFO] Setting load to: 0.033442
[INFO] Setting clock uncertainty to: 0.25
[INFO] Setting clock transition to: 0.1499999999999999944488848768742172978818416595458984375
[INFO] Setting timing derate to: 5%
[INFO] Setting signal min routing layer to: met1 and clock min routing layer to met1. 
[INFO] Setting signal max routing layer to: met5 and clock max routing layer to met5. 
-congestion_iterations 50 -verbose
[INFO GRT-0020] Min routing layer: met1
[INFO GRT-0021] Max routing layer: met5
[INFO GRT-0022] Global adjustment: 30%
[INFO GRT-0023] Grid origin: (0, 0)
[INFO GRT-0043] No OR_DEFAULT vias defined.
[INFO GRT-0088] Layer li1     Track-Pitch = 0.4600  line-2-Via Pitch: 0.3400
[INFO GRT-0088] Layer met1    Track-Pitch = 0.3400  line-2-Via Pitch: 0.3400
[INFO GRT-0088] Layer met2    Track-Pitch = 0.4600  line-2-Via Pitch: 0.3500
[INFO GRT-0088] Layer met3    Track-Pitch = 0.6800  line-2-Via Pitch: 0.6150
[INFO GRT-0088] Layer met4    Track-Pitch = 0.9200  line-2-Via Pitch: 1.0400
[INFO GRT-0088] Layer met5    Track-Pitch = 3.4000  line-2-Via Pitch: 3.1100
[INFO GRT-0019] Found 4 clock nets.
[INFO GRT-0001] Minimum degree: 2
[INFO GRT-0002] Maximum degree: 11
[INFO GRT-0003] Macros: 0
[INFO GRT-0043] No OR_DEFAULT vias defined.
[INFO GRT-0004] Blockages: 253

[INFO GRT-0053] Routing resources analysis:
          Routing      Original      Derated      Resource
Layer     Direction    Resources     Resources    Reduction (%)
---------------------------------------------------------------
li1        Vertical            0             0          0.00%
met1       Horizontal       1951           933          52.18%
met2       Vertical         1415           846          40.21%
met3       Horizontal        971           608          37.38%
met4       Vertical          586           327          44.20%
met5       Horizontal        187            88          52.94%
---------------------------------------------------------------

[INFO GRT-0197] Via related to pin nodes: 999
[INFO GRT-0198] Via related Steiner nodes: 9
[INFO GRT-0199] Via filling finished.
[INFO GRT-0111] Final number of vias: 1212
[INFO GRT-0112] Final usage 3D: 4056

[INFO GRT-0096] Final congestion report:
Layer         Resource        Demand        Usage (%)    Max H / Max V / Total Overflow
---------------------------------------------------------------------------------------
li1                  0             0            0.00%             0 /  0 /  0
met1               933           191           20.47%             0 /  0 /  0
met2               846           219           25.89%             0 /  0 /  0
met3               608            10            1.64%             0 /  0 /  0
met4               327             0            0.00%             0 /  0 /  0
met5                88             0            0.00%             0 /  0 /  0
---------------------------------------------------------------------------------------
Total             2802           420           14.99%             0 /  0 /  0

[INFO GRT-0018] Total wirelength: 5416 um
[INFO GRT-0014] Routed nets: 242
[INFO GRT-0006] Repairing antennas, iteration 1.
[INFO GRT-0043] No OR_DEFAULT vias defined.
[INFO GRT-0012] Found 0 antenna violations.
Placement Analysis
---------------------------------
total displacement          0.0 u
average displacement        0.0 u
max displacement            0.0 u
original HPWL            2999.4 u
legalized HPWL           3136.5 u
delta HPWL                    5 %

[INFO DPL-0020] Mirrored 75 instances
[INFO DPL-0021] HPWL before            3136.5 u
[INFO DPL-0022] HPWL after             2999.4 u
[INFO DPL-0023] HPWL delta               -4.4 %
-congestion_iterations 50 -verbose
[INFO GRT-0020] Min routing layer: met1
[INFO GRT-0021] Max routing layer: met5
[INFO GRT-0022] Global adjustment: 30%
[INFO GRT-0023] Grid origin: (0, 0)
[INFO GRT-0043] No OR_DEFAULT vias defined.
[INFO GRT-0088] Layer li1     Track-Pitch = 0.4600  line-2-Via Pitch: 0.3400
[INFO GRT-0088] Layer met1    Track-Pitch = 0.3400  line-2-Via Pitch: 0.3400
[INFO GRT-0088] Layer met2    Track-Pitch = 0.4600  line-2-Via Pitch: 0.3500
[INFO GRT-0088] Layer met3    Track-Pitch = 0.6800  line-2-Via Pitch: 0.6150
[INFO GRT-0088] Layer met4    Track-Pitch = 0.9200  line-2-Via Pitch: 1.0400
[INFO GRT-0088] Layer met5    Track-Pitch = 3.4000  line-2-Via Pitch: 3.1100
[INFO GRT-0019] Found 4 clock nets.
[INFO GRT-0001] Minimum degree: 2
[INFO GRT-0002] Maximum degree: 11
[INFO GRT-0003] Macros: 0
[INFO GRT-0043] No OR_DEFAULT vias defined.
[INFO GRT-0004] Blockages: 253

[INFO GRT-0053] Routing resources analysis:
          Routing      Original      Derated      Resource
Layer     Direction    Resources     Resources    Reduction (%)
---------------------------------------------------------------
li1        Vertical            0             0          0.00%
met1       Horizontal       1951           933          52.18%
met2       Vertical         1415           846          40.21%
met3       Horizontal        971           608          37.38%
met4       Vertical          586           327          44.20%
met5       Horizontal        187            88          52.94%
---------------------------------------------------------------

[INFO GRT-0197] Via related to pin nodes: 999
[INFO GRT-0198] Via related Steiner nodes: 9
[INFO GRT-0199] Via filling finished.
[INFO GRT-0111] Final number of vias: 1212
[INFO GRT-0112] Final usage 3D: 4056

[INFO GRT-0096] Final congestion report:
Layer         Resource        Demand        Usage (%)    Max H / Max V / Total Overflow
---------------------------------------------------------------------------------------
li1                  0             0            0.00%             0 /  0 /  0
met1               933           191           20.47%             0 /  0 /  0
met2               846           219           25.89%             0 /  0 /  0
met3               608            10            1.64%             0 /  0 /  0
met4               327             0            0.00%             0 /  0 /  0
met5                88             0            0.00%             0 /  0 /  0
---------------------------------------------------------------------------------------
Total             2802           420           14.99%             0 /  0 /  0

[INFO GRT-0018] Total wirelength: 5416 um
[INFO GRT-0014] Routed nets: 242
[INFO] Setting RC values…
Setting global connections for newly added cells…
[INFO] Setting global connections...
Updating metrics…
Cell type report:                       Count       Area
  Fill cell                                38     142.64
  Tap cell                                 42      52.55
  Clock buffer                              3      75.07
  Timing Repair Buffer                     75     462.94
  Inverter                                  2       7.51
  Clock inverter                            1       5.00
  Sequential cell                          17     425.41
  Multi-Input combinational cell          110     815.78
  Total                                   288    1986.91
Writing OpenROAD database to '/home/ngoduc/test_adder16/runs/RUN_2025-11-28_20-54-11/41-openroad-repairantennas/1-diodeinsertion/adder16.odb'…
Writing layout to '/home/ngoduc/test_adder16/runs/RUN_2025-11-28_20-54-11/41-openroad-repairantennas/1-diodeinsertion/adder16.def'…
